P100000120276,Jinye Iron and Steel Group Co Ltd,壶关县常平炼钢有限公司,"Huguan County Changping Steelmaking Co., Ltd., Jinye Steel Co., Ltd.","金烨钢铁有限公司, 金烨钢铁集团有限公司",Jinye Steel Group Co Ltd,金烨钢铁集团有限公司,E100000126800,unknown,,Jinye Steel Group Co Ltd [100.0%],E100000126800 [100.0%],unknown [100.0%],Yanjiahe,unknown,Shanxi,China,Asia Pacific,山西省长治市壶关县常平经济开发区闫家河村,"36.1481310, 113.2095230",exact,https://www.gem.wiki/Jinye_Iron_and_Steel_Group_Co_Ltd,22.34,unknown,unknown,2003-05-08 00:00:00,unknown,unknown,unknown,unknown,unknown,unknown,unknown,"semi-finished, finished rolled","spring steel, plate, cold rolled, billet, carbon steel, channel, i-beam, angle, wire","building and infrastructure, tools and machinery",215,2024-05-23 00:00:00,unknown,No,BF; BOF,unknown,unknown,unknown,Jinye Iron and Steel Group Co Ltd,壶关县常平炼钢有限公司,China,operating,2003-05-08 00:00:00,950,950.0,,,,1100,1100,,
P100000120083,Jiugang Group Yuzhong Iron and Steel Co Ltd,酒钢集团榆中钢铁有限责任公司,,,Jiugang Group Yuzhong Iron & Steel Co Ltd,酒钢集团榆中钢铁有限责任公司,E100000126330,unknown,,Gansu Jiu Steel Group Hongxing Iron and Steel Co Ltd [100.0%],E100000127239 [100.0%],unknown [100.0%],"Laizibao Township, Yuzhong County, Lanzhou City, Gansu Province",Lanzhou,Gansu,China,Asia Pacific,甘肃省兰州市榆中县来紫堡乡,"36.0336460, 104.0355350",exact,https://www.gem.wiki/Jiugang_Group_Yuzhong_Iron_and_Steel_Co_Ltd,22,unknown,unknown,2003,unknown,unknown,unknown,unknown,2255,373,unknown,finished rolled,"wire rod, rebar",unknown,2097,unknown,2021-12-08 00:00:00,No,BF; BOF,State Grid Gansu Lanzhou Power Supply Company,unknown,unknown,Jiugang Group Yuzhong Iron and Steel Co Ltd,酒钢集团榆中钢铁有限责任公司,China,operating,2003,4000,4000.0,,,,1520,1520,,
P100000120213,Jiujiang Pinggang Iron and Steel Co Ltd,九江萍钢钢铁有限公司,PXSteel Jiujiang,,JiuJiang PXSteel Co Ltd,九江萍钢钢铁有限公司,E100000123182,unknown,,Beijing Fangda International Industrial Investment Group Co Ltd [60.9%]; unknown [21.5%]; Jiangxi Pxsteel Industrial Co Ltd [10.3%]; Gongqingcheng Huaershun Investment Center LP [7.3%],E100000128862 [60.9%]; E100000132388 [21.5%]; E100000123335 [10.3%]; E100000124737 [7.3%],unknown [60.9%]; unknown [21.5%]; unknown [10.3%]; unknown [7.3%],High-tech Industrial Park,unknown,Jiangxi,China,Asia Pacific,江西省九江市湖口县高新技术产业园区,"29.7784310, 116.2752700",exact,https://www.gem.wiki/Jiujiang_Pinggang_Iron_and_Steel_Co_Ltd,13.65,unknown,unknown,2012-01-16 00:00:00,unknown,unknown,unknown,unknown,unknown,unknown,unknown,finished rolled,"wire rod, bar, plate","building and infrastructure, tools and machinery, transport",6045,2024-10-11 00:00:00,2022-06-28 00:00:00,No,BF; BOF,unknown,unknown,unknown,Jiujiang Pinggang Iron and Steel Co Ltd,九江萍钢钢铁有限公司,China,operating,2012-01-16 00:00:00,4700,4700.0,,,,4630,4630,,
P100000120254,Laiwu Iron and Steel Group Yinshan Section Steel Co Ltd,莱芜钢铁集团银山型钢有限公司,,,Laiwu Steel Yinshan Section Co Ltd,莱芜钢铁集团银山型钢有限公司,E100000126374,unknown,Full,Shandong Iron and Steel Group Co Ltd [70.0%]; Shandong Guohui Investment Co Ltd [20.0%]; Shandong Caixin Asset Operation Co Ltd [10.0%],E100000124598 [70.0%]; E100000124585 [20.0%]; E100000124453 [10.0%],unknown [70.0%]; unknown [20.0%]; unknown [10.0%],Shuangquan Road,unknown,Shandong,China,Asia Pacific,山东省莱芜市钢城区双泉路,"36.1061430, 117.8201080",exact,https://www.gem.wiki/Laiwu_Iron_and_Steel_Group_Yinshan_Section_Steel_Co_Ltd,21.71,unknown,unknown,2003-12-26 00:00:00,unknown,unknown,unknown,unknown,unknown,unknown,unknown,"semi-finished, finished rolled","billet, strip, sections","automotive, building and infrastructure, tools and machinery",4449,2024-01-28 00:00:00,2022-01-21 00:00:00,No,BF; BOF,unknown,unknown,unknown,Laiwu Iron and Steel Group Yinshan Section Steel Co Ltd,莱芜钢铁集团银山型钢有限公司,China,operating,2003-12-26 00:00:00,5001,5001.0,,,,5860,5860,,
P100000120344,Lanxin Steel Group Co Ltd plant,兰鑫钢铁集团有限公司,"Gaolan Lanxin Steel Co., Ltd.",皋兰兰鑫钢铁有限公司,Gaolan County Lanxin Steel Co Ltd,兰鑫钢铁集团有限公司,E100000126506,unknown,,Gaolan County Lanxin Steel Co Ltd [100.0%],E100000126506 [100.0%],unknown [100.0%],"Xindi Village, Heishi Town, Gaolan County, Lanzhou City, Gansu Province",Lanzhou,Gansu,China,Asia Pacific,甘肃省兰州市皋兰县黑石镇新地村,"36.4888660, 103.9220000",exact,https://www.gem.wiki/Lanxin_Steel_Group_Co_Ltd_plant,24,unknown,unknown,2001,unknown,unknown,unknown,unknown,unknown,unknown,unknown,finished rolled,rebar,building and infrastructure,2584,2024-01-05 00:00:00,2024-04-17 00:00:00,No,BF; BOF; EAF,Coal Gas Recovery and Comprehensive Utilization Power Generation,unknown,unknown,Lanxin Steel Group Co Ltd plant,兰鑫钢铁集团有限公司,China,operating,2001,1100,700.0,400,,,1150,1150,,
P100000120181,Lengshuijiang Steel Co Ltd,冷水江博大钢铁有限公司,"Lengshuijiang Boda Steel Co., Ltd.",冷水江钢铁有限责任公司,Lengshuijiang Iron and Steel Co Ltd,冷水江钢铁有限责任公司,E100000126341,unknown,,Lengshuijiang Xingbo Enterprise Management Co Ltd [49.6%]; unknown [28.6%]; Shanghai Baoke Enterprise Development Co Ltd [15.0%]; Shanghai Zhenchang Metal Resources Group Co Ltd [5.4%]; Shanghai Zhenchang Waste and Scrap Metal Recycling Co Ltd [1.4%],E100000128565 [49.6%]; E100000132388 [28.6%]; E100000127514 [15.0%]; E100000128282 [5.4%]; E100000127515 [1.4%],unknown [49.6%]; unknown [28.6%]; unknown [15.0%]; unknown [5.4%]; unknown [1.4%],Zhagang Road,Lengshuijiang,Hunan,China,Asia Pacific,湖南省冷水江市轧钢路,"27.6904010, 111.4372880",exact,https://www.gem.wiki/Lengshuijiang_Steel_Co_Ltd,67,unknown,unknown,1958,unknown,unknown,unknown,unknown,unknown,unknown,unknown,finished rolled,wire,"building and infrastructure, transport",3059,2022-11-22 00:00:00,2023-02-14 00:00:00,No,BF; BOF,unknown,unknown,unknown,Lengshuijiang Steel Co Ltd,冷水江博大钢铁有限公司,China,operating,1958,3000,3000.0,,,,2999,2999,,
P100000120192,Lianfeng Steel Zhangjiagang Co Ltd,联峰钢铁(张家港)有限公司,,,Lianfeng Steel (Zhangjiagang) Co Ltd,联峰钢铁（张家港）有限公司,E100000126766,unknown,,"Sirida (Hong Kong) Group Co Ltd [42.7%]; Zhangjiagang Yongrun Investment Development Co Ltd [18.5%]; Suzhou Yongyuan Holding Co Ltd [14.5%]; Yonglian Village Stock Economic Cooperative, Nanfeng Town, Zhangjiagang City [9.3%]; unknown [4.3%]; Hengde International Co Ltd [3.4%]; Zhangjiagang Yongfeng Investment Development Co Ltd [3.2%]; Jiangsu Shagang Group Co Ltd [2.7%]; Zhangjiagang Free Trade Zone Runyuan Stainless Steel Trade Co Ltd [0.8%]; Ningbo Meishan Free Trade Port Jincheng Shazhou Equity Investment Co Ltd [0.6%]",E100000130645 [42.7%]; E100000128818 [18.5%]; E100000128947 [14.5%]; E100000130337 [9.3%]; E100000132388 [4.3%]; E100000125940 [3.4%]; E100000128820 [3.2%]; E100000122410 [2.7%]; E100000124037 [0.8%]; E100000124038 [0.6%],unknown [42.7%]; unknown [18.5%]; 5087170217 [14.5%]; unknown [9.3%]; unknown [4.3%]; unknown [3.4%]; unknown [3.2%]; unknown [2.7%]; unknown [0.8%]; unknown [0.6%],Yonglian Industrial Park,Nanfeng,Jiangsu,China,Asia Pacific,江苏省张家港市南丰镇永联工业园,"31.8552050, 120.7305050",exact,https://www.gem.wiki/Lianfeng_Steel_Zhangjiagang_Co_Ltd,23.21,unknown,unknown,2002-06-26 00:00:00,unknown,unknown,unknown,unknown,12000,unknown,unknown,finished rolled,"wire rod, wire, hot rolled","automotive, building and infrastructure, energy, tools and machinery, transport",4746,unknown,unknown,No,BF; BOF; EAF,State Grid & 3.55MW Saturated Steam Power Generation,unknown,unknown,Lianfeng Steel Zhangjiagang Co Ltd,联峰钢铁(张家港)有限公司,China,operating,2002-06-26 00:00:00,6720,5720.0,1000,,,5991,5991,,
P100000121078,Lianyungang Huale Alloy Group Co Ltd,连云港华乐合金有限公司,"Lianyungang Huale Alloy Co., Ltd.",连云港华乐合金集团有限公司,Lianyungang Huale Alloy Group Co Ltd,连云港华乐合金集团有限公司,E100000127135,unknown,,Lianyungang Huale Alloy Group Co Ltd [100.0%],E100000127135 [100.0%],unknown [100.0%],Banqiao Industrial Park,unknown,Jiangsu,China,Asia Pacific,江苏省连云港市连云区板桥工业园区,"34.6079640, 119.4476260",exact,https://www.gem.wiki/Lianyungang_Huale_Alloy_Group_Co_Ltd,15.5,unknown,unknown,2010-03-12 00:00:00,unknown,unknown,unknown,unknown,unknown,unknown,unknown,finished rolled,"cold rolled, strip","building and infrastructure, energy, tools and machinery",214,2023-01-13 00:00:00,2022-09-29 00:00:00,No,BF; BOF,unknown,unknown,unknown,Lianyungang Huale Alloy Group Co Ltd,连云港华乐合金有限公司,China,operating,2010-03-12 00:00:00,621,621.0,,,,460,460,,
P100000120197,Lianyungang Xingxin Iron and Steel Co Ltd,灌南兴鑫钢铁有限公司,"Guannan Xingxin Iron and Steel Co., Ltd.",连云港兴鑫钢铁有限公司,Lianyungang Xingxin Iron and Steel Co Ltd,连云港兴鑫钢铁有限公司,E100000123183,unknown,,Lianyungang Xingxin Iron and Steel Co Ltd [100.0%],E100000123183 [100.0%],unknown [100.0%],Dazui,Gougang,Jiangsu,China,Asia Pacific,江苏省连云港市灌南县半岛临港产业区沟港镇大咀村,"34.3838100, 119.7868780",exact,https://www.gem.wiki/Lianyungang_Xingxin_Iron_and_Steel_Co_Ltd,21.87,unknown,unknown,2003-10-28 00:00:00,unknown,unknown,unknown,unknown,unknown,unknown,unknown,finished rolled,rebar,"building and infrastructure, tools and machinery",2801,2024-05-24 00:00:00,2024-07-16 00:00:00,No,BF; BOF,unknown,unknown,unknown,Lianyungang Xingxin Iron and Steel Co Ltd,灌南兴鑫钢铁有限公司,China,operating,2003-10-28 00:00:00,3000,3000.0,,,,3000,3000,,
P100000120348,Lianyungang Yaxin Iron and Steel Co Ltd,连云港亚新钢铁有限公司,,,Lianyungang Yaxin Iron and Steel Co Ltd,连云港亚新钢铁有限公司,E100000126647,unknown,,Lianyungang Yaxin Iron and Steel Co Ltd [100.0%],E100000126647 [100.0%],unknown [100.0%],unknown,Duigougang,Jiangsu,China,Asia Pacific,江苏省连云港市灌南县堆沟港镇,"34.4237860, 119.7783110",exact,https://www.gem.wiki/Lianyungang_Yaxin_Iron_and_Steel_Co_Ltd,16.06,unknown,unknown,2009-08-18 00:00:00,unknown,unknown,unknown,unknown,unknown,unknown,unknown,finished rolled,wire,building and infrastructure,3092,2024-01-05 00:00:00,2022-12-08 00:00:00,No,BF; BOF,3.214 Megawatt Rooftop Photovoltaic Power Generation,unknown,unknown,Lianyungang Yaxin Iron and Steel Co Ltd,连云港亚新钢铁有限公司,China,operating,2009-08-18 00:00:00,3000,3000.0,,,,2800,2800,,
P100000120333,Liaoyang United Steel Co Ltd,辽宁澎辉铸业有限公司,"Liaoning Penghui Casting Co., Ltd.",辽阳联合钢铁有限公司,Liaoyang United Steel Co Ltd,辽阳联合钢铁有限公司,E100000126207,unknown,,Liaoyang United Steel Co Ltd [100.0%],E100000126207 [100.0%],unknown [100.0%],Laba,Liuerbao,Liaoning,China,Asia Pacific,辽宁省辽阳市辽阳县刘二堡镇喇叭村,"41.1913800, 122.8773110",exact,https://www.gem.wiki/Liaoyang_United_Steel_Co_Ltd,5.73,unknown,unknown,2019-12-18 00:00:00,unknown,unknown,unknown,unknown,unknown,unknown,unknown,unknown,unknown,unknown,1753,unknown,unknown,No,BF; BOF,unknown,unknown,unknown,Liaoyang United Steel Co Ltd,辽宁澎辉铸业有限公司,China,operating,2019-12-18 00:00:00,2300,2300.0,,,,2260,2260,,
P100000121051,Liaoyang Xinyi Special Steel Co Ltd,辽阳新达钢铁有限公司,"Liaoyang Xinda Iron and Steel Co., Ltd.",辽阳鑫亿特钢有限公司,Liaoyang Xinyi Special Steel Co Ltd,辽阳鑫亿特钢有限公司,E100000126978,unknown,,Liaoyang Xinyi Special Steel Co Ltd [100.0%],E100000126978 [100.0%],unknown [100.0%],Gaozhuangzi,Liuerbao,Liaoning,China,Asia Pacific,辽宁省辽阳县刘二堡镇高庄子村,"41.2250030, 122.9704880",exact,https://www.gem.wiki/Liaoyang_Xinyi_Special_Steel_Co_Ltd,16.76,unknown,unknown,2008-12-08 00:00:00,unknown,unknown,unknown,,,,,finished rolled,unknown,"building and infrastructure, tools and machinery, transport",245,2024-04-07 00:00:00,unknown,No,EAF,State Grid Liaoyang Power Supply Company,unknown,unknown,Liaoyang Xinyi Special Steel Co Ltd,辽阳新达钢铁有限公司,China,operating,2008-12-08 00:00:00,500,,500,,,,,,
P100000120269,Licheng Taihang Iron and Steel Co Ltd,黎城太行钢铁有限公司,,,Licheng Taihang Iron & Steel Co Ltd,黎城太行钢铁有限公司,E100000126125,unknown,,Licheng Taihang Iron & Steel Co Ltd [100.0%],E100000126125 [100.0%],unknown [100.0%],Chengnan,unknown,Shanxi,China,Asia Pacific,山西省长治市黎城县城南村,"36.4723030, 113.3441550",exact,https://www.gem.wiki/Licheng_Taihang_Iron_and_Steel_Co_Ltd,25.24,unknown,unknown,2000-06-15 00:00:00,unknown,unknown,unknown,unknown,unknown,unknown,unknown,finished rolled,"round bar, rebar, wire, bar","building and infrastructure, energy, tools and machinery, transport",1985,2022-01-11 00:00:00,2024-04-11 00:00:00,No,BF; BOF,unknown,unknown,unknown,Licheng Taihang Iron and Steel Co Ltd,黎城太行钢铁有限公司,China,operating,2000-06-15 00:00:00,1700,1700.0,,,,618,618,,
P100000120225,Lingyuan Iron and Steel Co Ltd,凌源钢铁股份有限公司,,,Lingyuan Iron & Steel Co Ltd,凌源钢铁股份有限公司,E100000126754,unknown,,Lingyuan Iron & Steel Co Ltd [100.0%],E100000126754 [100.0%],unknown [100.0%],No. 3 Gangtie Road,unknown,Liaoning,China,Asia Pacific,辽宁省朝阳市凌源市钢铁路3号,"41.2710480, 119.4137400",exact,https://www.gem.wiki/Lingyuan_Iron_and_Steel_Co_Ltd,31.35,unknown,unknown,1994-05-04 00:00:00,unknown,unknown,unknown,unknown,unknown,unknown,unknown,finished rolled,"pipe, rebar, wire, bar",unknown,6452,2024-07-10 00:00:00,unknown,No,BF; BOF,unknown,unknown,unknown,Lingyuan Iron and Steel Co Ltd,凌源钢铁股份有限公司,China,operating,1994-05-04 00:00:00,5994,5994.0,,,,5300,5300,,
P100000120330,Linyi Iron and Steel Investment Group Co Ltd,临沂钢铁投资集团有限公司,,,Linyi Iron and Steel Investment Group Co Ltd,临沂钢铁投资集团有限公司,E100000123322,unknown,Partial,Linyi Investment Development Co Ltd [74.4%]; Gangfa International [16.7%]; Shandong Caixin Asset Operation Co Ltd [8.3%]; unknown [0.7%],E100000000234 [74.4%]; E100000125831 [16.7%]; E100000124453 [8.3%]; E100000132388 [0.7%],unknown [74.4%]; unknown [16.7%]; unknown [8.3%]; unknown [0.7%],unknown,Tuanlin,Shandong,China,Asia Pacific,山东省临沂市临港经济开发区产业园区团林镇,"35.1573500, 119.1339990",exact,https://www.gem.wiki/Linyi_Iron_and_Steel_Investment_Group_Co_Ltd,6.48,unknown,unknown,2019-03-20 00:00:00,unknown,unknown,unknown,unknown,3840,unknown,unknown,unknown,unknown,unknown,16,unknown,unknown,No,BF; BOF; EAF,unknown,unknown,unknown,Linyi Iron and Steel Investment Group Co Ltd,临沂钢铁投资集团有限公司,China,operating,2019-03-20 00:00:00,3400,2700.0,700,,,2310,2310,,
P100000120399,Lishui Huahong Iron and Steel Products Co Ltd,丽水华宏钢铁制品有限公司,,,Huahong Iron and Steel Products Co Ltd,丽水华宏钢铁制品有限公司,E100000127001,unknown,,Huahong Iron and Steel Products Co Ltd [100.0%],E100000127001 [100.0%],unknown [100.0%],Chonghe,unknown,Zhejiang,China,Asia Pacific,浙江省丽水市云和县凤凰山街道重河村,"28.0900980, 119.5195090",exact,https://www.gem.wiki/Lishui_Huahong_Iron_and_Steel_Products_Co_Ltd,22.95,unknown,unknown,2002-09-28 00:00:00,unknown,unknown,unknown,,,,,finished rolled,rebar,building and infrastructure,181,2023-05-15 00:00:00,Expired,No,EAF,State Grid Lishui Power Supply Company,unknown,unknown,Lishui Huahong Iron and Steel Products Co Ltd,丽水华宏钢铁制品有限公司,China,operating,2002-09-28 00:00:00,1200,,1200,,,,,,
P100000120092,Liuzhou Iron and Steel Co Ltd Liuzhou Base,柳州钢铁股份有限公司(柳州本部),Guangxi Liuzhou Iron and Steel (Group) Company,广西柳州金程股份有限公司,Liuzhou IRON&STEEL Co Ltd,柳州钢铁股份有限公司,E100000123902,unknown,,Liuzhou IRON&STEEL Co Ltd [100.0%],E100000123902 [100.0%],unknown [100.0%],"No. 117 Beique Road, Liuzhou City, Guangxi Zhuang Autonomous Region",Liuzhou,Guangxi,China,Asia Pacific,广西柳州市北雀路117号,"24.3853040, 109.3796300",exact,https://www.gem.wiki/Liuzhou_Iron_and_Steel_Co_Ltd_Liuzhou_Base,25,unknown,unknown,2000,unknown,unknown,unknown,unknown,unknown,unknown,unknown,finished rolled,"wire rod, profile, plate","automotive, building and infrastructure, energy, tools and machinery, transport",9566,2022-06-20 00:00:00,2023-07-18 00:00:00,No,BF; BOF,unknown,unknown,unknown,Liuzhou Iron and Steel Co Ltd Liuzhou Base,柳州钢铁股份有限公司(柳州本部),China,operating,2000,9458,9458.0,,,,8930,8930,,
P100000120382,Liyang Baorun Steel Co Ltd,溧阳宝润钢铁有限公司,,,Liyang Baorun Steel Co Ltd,溧阳宝润钢铁有限公司,E100000126811,unknown,,Jiangsu Delong Nickel Industry Co Ltd [100.0%],E100000126498 [100.0%],5074552962 [100.0%],No. 288 Kunlun North Road,Changzhou,Jiangsu,China,Asia Pacific,江苏省溧阳市昆仑北路288号,"31.4711230, 119.4859410",exact,https://www.gem.wiki/Liyang_Baorun_Steel_Co_Ltd,2,2021-11-01 00:00:00,unknown,2023,unknown,unknown,unknown,,,,,unknown,unknown,unknown,178,unknown,unknown,No,EAF,State Grid Jiangsu Electric Power Company,unknown,unknown,Liyang Baorun Steel Co Ltd,溧阳宝润钢铁有限公司,China,operating,2023,2760,,2760,,,,,,
P100000120335,Luzhou Xinyang Vanadium Titanium Steel Co Ltd,泸州鑫阳钒钛钢铁有限公司,,,Luzhou Xinyang Vanadium Titanium Steel Co Ltd,泸州鑫阳钒钛钢铁有限公司,E100000126425,unknown,,Luzhou Chengkun Industry Co Ltd [70.0%]; Sichuan Luzhou Jiangyang Iron and Steel Co Ltd [30.0%],E100000128540 [70.0%]; E100000128084 [30.0%],unknown [70.0%]; unknown [30.0%],Hejiang Circular Economy Industrial Park,Luzhou,Sichuan,China,Asia Pacific,四川省泸州市合江循环经济产业园区,"28.8517790, 105.7050900",exact,https://www.gem.wiki/Luzhou_Xinyang_Vanadium_Titanium_Steel_Co_Ltd,5.67,unknown,unknown,2020-01-08 00:00:00,unknown,unknown,unknown,,,,,finished rolled,unknown,building and infrastructure,32,2024-06-20 00:00:00,2021-06-20 00:00:00,No,EAF,State Grid Luzhou Power Supply Company,unknown,unknown,Luzhou Xinyang Vanadium Titanium Steel Co Ltd,泸州鑫阳钒钛钢铁有限公司,China,operating,2020-01-08 00:00:00,2000,,2000,,,,,,
P100000120260,Lvliang Jianlong Industrial Co Ltd,文水海威钢铁有限公司,"Wenshui Haiwei Steel Co., Ltd.",吕梁建龙实业有限公司,Lvliang Jianlong Industrial Co Ltd,吕梁建龙实业有限公司,E100000126132,unknown,,China Great Wall Asset Management Co Ltd [48.0%]; Beijing Jianlong Investment Co Ltd [45.5%]; unknown [6.5%],E100000124790 [48.0%]; E100000000155 [45.5%]; E100000132388 [6.5%],unknown [48.0%]; unknown [45.5%]; unknown [6.5%],Sang,Lvliang,Shanxi,China,Asia Pacific,山西省文水经济开发区桑村产业园,"37.47311, 112.06093",exact,https://www.gem.wiki/Lvliang_Jianlong_Industrial_Co_Ltd,40,unknown,unknown,1985,unknown,unknown,unknown,unknown,unknown,unknown,unknown,finished rolled,rebar,"automotive, building and infrastructure, tools and machinery",2132,2022-11-29 00:00:00,2022-11-29 00:00:00,No,BF; BOF,unknown,unknown,unknown,Lvliang Jianlong Industrial Co Ltd,文水海威钢铁有限公司,China,operating,1985,1400,1400.0,,,,1535,1535,,
P100000120069,Maanshan Iron and Steel Co Ltd,马鞍山钢铁股份有限公司(本部),,,Maanshan Iron & Steel Co Ltd,马鞍山钢铁股份有限公司,E100000123737,4295864332,,Maanshan Iron & Steel Co Ltd [100.0%],E100000123737 [100.0%],4295864332 [100.0%],"Yushan District, Ma'anshan City",Ma'anshan,Anhui,China,Asia Pacific,安徽省马鞍山市雨山区,"31.6988840, 118.4681940",exact,https://www.gem.wiki/Maanshan_Iron_and_Steel_Co_Ltd,72,unknown,unknown,1953,unknown,unknown,unknown,unknown,18440,4430,2670,finished rolled,"wire rod, sections, plate","automotive, building and infrastructure, energy, tools and machinery, transport",12221,2024-01-26 00:00:00,2024-01-26 00:00:00,No,BF; BOF; EAF,Ma'anshan Steel power station/Rooftop Distributed Photovoltaic Power Generation,"Nanshan Mine, Gushan Mine, Taochong Mine, Luohe Mine, and Zhangzhuang Mine",unknown,Maanshan Iron and Steel Co Ltd,马鞍山钢铁股份有限公司(本部),China,operating,1953,15480,14650.0,830,,,14500,14500,,
P100000120190,Nanjing Iron and Steel Co Ltd,南京南钢产业发展有限公司,"NISCO, Nangang",南京钢铁股份有限公司,Nanjing Iron & Steel Co Ltd,南京钢铁股份有限公司,E100000123506,unknown,,Nanjing Iron & Steel Co Ltd [100.0%],E100000123506 [100.0%],unknown [100.0%],No. 8 Xingfu Road,Nanjing,Jiangsu,China,Asia Pacific,江苏省南京市六合区幸福路8号 (南京市六合区卸甲甸),"32.2007970, 118.7463150",exact,https://www.gem.wiki/Nanjing_Iron_and_Steel_Co_Ltd,67,unknown,unknown,1958,unknown,unknown,unknown,unknown,unknown,unknown,unknown,finished rolled,"bearings, wire, plate","automotive, building and infrastructure, energy, transport",4839,2024-08-28 00:00:00,2023-01-12 00:00:00,No,BF; BOF,20 MW Rooftop Photovoltaic Power Generation,unknown,unknown,Nanjing Iron and Steel Co Ltd,南京南钢产业发展有限公司,China,operating,1958,10000,10000.0,,,,8600,8600,,
P100000120165,Nanyang Hanye Special Steel Co Ltd,南阳汉冶特钢有限公司,,,Nanyang Hanye SPECIAL STREET Co Ltd,南阳汉冶特钢有限公司,E100000126908,unknown,,Henan Longcheng Group Co Ltd [100.0%],E100000127544 [100.0%],unknown [100.0%],"Guzhuanghe Village, Huiche Town, Xixia County, Nanyang City, Henan Province",Nanyang,Henan,China,Asia Pacific,河南省南阳市西峡县回车镇古庄河村,"33.2693240, 111.5346350",exact,https://www.gem.wiki/Nanyang_Hanye_Special_Steel_Co_Ltd,22,unknown,unknown,2003,unknown,unknown,unknown,unknown,unknown,unknown,unknown,finished rolled,"special, plate",unknown,3375,2022-08-25 00:00:00,2024-03-15 00:00:00,No,BF; BOF,unknown,"Vertical integration - Longcheng Special Materials Co., Ltd.","Vertical integration - Henan Longcheng Group Co., Ltd. has rights to 12 mining areas including Lushan and Xincai",Nanyang Hanye Special Steel Co Ltd,南阳汉冶特钢有限公司,China,operating,2003,3000,3000.0,,,,2244,2244,,
P100000120400,Ningbo Haoyang New Materials Techonology Co Ltd,宁波昊阳新材料科技有限公司,,,Ningbo Haoyang New MATERIALS Techonology Co Ltd,宁波昊阳新材料科技有限公司,E100000126616,unknown,,Ningbo Haoyang New MATERIALS Techonology Co Ltd [100.0%],E100000126616 [100.0%],unknown [100.0%],"No. 18, Langhai North Road",Binhai New Town,Zhejiang,China,Asia Pacific,浙江省宁波市余姚经济开发区滨海新城朗海北路18号,"30.2671130, 121.0525030",exact,https://www.gem.wiki/Ningbo_Haoyang_New_Materials_Techonology_Co_Ltd,13.67,unknown,unknown,2012-01-10 00:00:00,unknown,unknown,unknown,,,,,finished rolled,unknown,tools and machinery,400,2023-12-29 00:00:00,2023-11-01 00:00:00,No,EAF,8.9 megawatt photovoltaic power generation,unknown,unknown,Ningbo Haoyang New Materials Techonology Co Ltd,宁波昊阳新材料科技有限公司,China,operating,2012-01-10 00:00:00,500,,500,,,,,,
P100000120305,Ningbo Iron and Steel Co Ltd,宁波建龙钢铁有限公司,"Ningbo Jianlong Steel Co., Ltd.",宁波钢铁有限公司,Ningbo Iron & Steel Co Ltd,宁波钢铁有限公司,E100000126299,unknown,,Hang Zhou Iron & Steel Co Ltd [100.0%],E100000127605 [100.0%],unknown [100.0%],168 Lingang 2nd Road,unknown,Zhejiang,China,Asia Pacific,浙江省宁波市北仑区临港二路168号,"29.9187760, 121.8764230",exact,https://www.gem.wiki/Ningbo_Iron_and_Steel_Co_Ltd,22.66,unknown,unknown,2003-01-14 00:00:00,unknown,unknown,unknown,unknown,4402,756,unknown,finished rolled,"structural, electrical",unknown,2979,2024-07-22 00:00:00,2023-10-20 00:00:00,No,BF; BOF,Utilizing the waste heat from high-energy-consuming equipment and idle construction sites to build photovoltaic power station,unknown,unknown,Ningbo Iron and Steel Co Ltd,宁波建龙钢铁有限公司,China,operating,2003-01-14 00:00:00,3999,3999.0,,,,4260,4260,,
P100000120232,Ningxia Iron and Steel Group Co Ltd,宁夏钢铁(集团)有限责任公司,,,Ningxia Iron and Steel (Group) Co Ltd,宁夏钢铁（集团）有限责任公司,E100000127269,unknown,,Ningxia Haofeng Weiye Steel Co Ltd [79.0%]; natural person(s) [21.0%],E100000127604 [79.0%]; E100000123261 [21.0%],unknown [79.0%]; unknown [21.0%],East of Ninggang Avenue,Meili Industrial Park,Ningxia,China,Asia Pacific,宁夏中卫市沙坡头区美利工业园区宁钢大道东侧,"37.5030540, 105.0783480",exact,https://www.gem.wiki/Ningxia_Iron_and_Steel_Group_Co_Ltd,67,unknown,unknown,1958,unknown,unknown,unknown,unknown,unknown,unknown,unknown,finished rolled,"cord, spring steel, wire, wire rod",unknown,944,2023-07-13 00:00:00,Expired,No,BF; BOF,unknown,unknown,unknown,Ningxia Iron and Steel Group Co Ltd,宁夏钢铁(集团)有限责任公司,China,operating,1958,1800,1800.0,,,,2590,2590,,
