P100000120492,Sovel Almyros steel plant,,,,Sovel SA,,E100000130767,4296104408,,Viohalco SA [28.6%],E100000131005 [28.6%],5040438569 [28.6%],"Almyros, Greece",Almyros,Thessaly,Greece,Europe,,"39.1696320, 22.8402160",exact,https://www.gem.wiki/Sovel_Almyros_steel_plant,24,unknown,unknown,2001,unknown,unknown,unknown,,,,,"semi-finished, finished rolled","coil, rebar, mesh, bar","automotive, energy, transport",583,Yes,Yes,No,EAF,unknown,unknown,unknown,Sovel Almyros steel plant,,Greece,operating,2001,1350,,1350,,,,,,
P100000120494,AG Sidegua Masagua steel plant,Planta siderúrgica AG Sidegua Masagua,,Siderúrgica de Guatemala,Corporación AG SA,,E100001010295,5070512315,,Fundacion Jose Luis Gabriel; Industrial Assets Fund LP,E100002016465; E100002016466,unknown; unknown,"Kilómetro 65.5, Antigua Carretera al Puerto de San José",Masagua,Escuintla,Guatemala,Central & South America,,"14.2320070, -90.8154440",exact,https://www.gem.wiki/AG_Sidegua_Masagua_steel_plant,31,unknown,1991,1994,unknown,unknown,unknown,,,,,semi-finished,"billet, rod, profile",building and infrastructure,1080,unknown,unknown,No,EAF,unknown,unknown,unknown,AG Sidegua Masagua steel plant,Planta siderúrgica AG Sidegua Masagua,Guatemala,operating,1994,500,,500,,,,,,
P100001045296,Action Ispat and Power Jharsuguda steel plant,,,,Action Ispat and Power Pvt Ltd,,E100002007999,5001237543,,Action Ispat and Power Pvt Ltd [100.0%],E100002007999 [100.0%],5001237543 [100.0%],unknown,Pandripathar,Odisha,India,Asia Pacific,,"21.8397590, 83.9822270",exact,https://www.gem.wiki/Action_Ispat_and_Power_Jharsuguda_steel_plant,unknown,unknown,unknown,unknown,unknown,unknown,unknown,,unknown,,unknown,unknown,unknown,unknown,unknown,unknown,unknown,No,DRI; Steel other/unspecified,16 MW WHRB-based CPP; 106 MW FBB CPP,unknown,unknown,Action Ispat and Power Jharsuguda steel plant,,India,operating,unknown,375,,,,375,220,,220,
P100001025815,Adhunik Metaliks Kuanrmunda steel plant,,"AML, Neepaz Metaliks Pvt Ltd (formerly)",,Adhunik Metaliks Ltd,,E100001000387,4295873516,,natural person(s) [36.1%]; small shareholder(s) [28.8%]; Mahanada Suppliers Pvt Ltd [22.6%]; Sunrwoth Stocks Pvt Ltd [12.5%],E100000123261 [36.1%]; E100001015587 [28.8%]; E100001016502 [22.6%]; E100001016503 [12.5%],unknown [36.1%]; unknown [28.8%]; 5035484293 [22.6%]; unknown [12.5%],unknown,Kuanrmunda,Odisha,India,Asia Pacific,,"22.3083710, 84.7635840",exact,https://www.gem.wiki/Adhunik_Metaliks_Kuanrmunda_steel_plant,22.36,unknown,unknown,2003-05-01 00:00:00,unknown,unknown,unknown,unknown,unknown,unknown,unknown,semi-finished,billet,"automotive, energy, tools and machinery",1500,unknown,unknown,No,BF; EAF; DRI,34 MW CPP,Kulum mines; Khajurdihi Mines,Patrapada Coal block,Adhunik Metaliks Kuanrmunda steel plant,,India,operating,2003-05-01 00:00:00,500,,500,,,330,180,150,
P100000120513,ArcelorMittal Nippon Steel Hazira Plant,,"Essar Steel (predecessor), ESIL (predecessor), AM/NS Essar Steel India Limited steel plant",,ArcelorMittal Nippon Steel India Ltd,,E100000002455,5082050876,,ArcelorMittal SA [60.0%]; Nippon Steel Corp [40.0%],E100000000687 [60.0%]; E100000000652 [40.0%],5000030092 [60.0%]; 4295877313 [40.0%],"27 KM, Surat-Hazira, Gujarat 394270 India",Hazira,Gujarat,India,Asia Pacific,,"21.1123770, 72.6473040",exact,https://www.gem.wiki/ArcelorMittal_Nippon_Steel_Hazira_Plant,30,unknown,unknown,1995,unknown,unknown,unknown,unknown,1480,1350,4000,"semi-finished, finished rolled","galvanized, plate, pipe, cold rolled, hot rolled","automotive, building and infrastructure, energy, steel packaging, tools and machinery, transport",7000,2024-05-03 00:00:00,2022-12-16 00:00:00,No,Iron other/unspecified; BOF; BF; DRI; EAF; Steel other/unspecified,"515 MW natural gas-fired combined cycle power plant (1997), 500 MW natural gas-fired combined cycle power plant (2005); working to install a 989MW renewable energy (solar/wind) plant",Captive iron ore mines at Thakurani and Sagasahi in Odisha,unknown,ArcelorMittal Nippon Steel Hazira Plant,,India,operating,1995,9600,,4600,,5000,11570,2040,7830,1700
P100000120568,Arjas Steel Tadipatri plant,,Gerdau Steel India (formerly),,Arjas Steel Pvt Ltd,,E100000130841,4297665844,,ADV Partners Holdings Ltd,E100001016284,unknown,"Jambulapadu(v) Tadipatri Mandal, Ananthpur District Andhra Pradesh, Pincode - 515411, India",Tadipatri,Andhra Pradesh,India,Asia Pacific,,"14.8734710, 78.0484250",exact,https://www.gem.wiki/Arjas_Steel_Tadipatri_plant,12.86,unknown,unknown,2012-11-01 00:00:00,unknown,unknown,unknown,,450,200,unknown,"semi-finished, finished rolled","square, rounds, profile, bar","automotive, building and infrastructure, energy, steel packaging, tools and machinery, transport",1800,Expired,2024-01-10 00:00:00,No,BF; BOF,two captive power plants (15 MW COG-based WHR power plant + 6 MW Blast furnace gas based),"Bellary, Hospet, Kurnool, Kadappa",unknown,Arjas Steel Tadipatri plant,,India,operating,2012-11-01 00:00:00,334,334.0,,,,324,324,,
P100000120564,Atibir Industries Bhorandiha steel plant,,Atibir Industries Unit-II,,Atibir Industries Co Ltd,,E100000131001,5039942952,,Sribir Group of Companies,E100001016293,unknown,"Bhorandiha, Udnabad, Giridih (Jharkhand), India",Bhorandiha,Jharkhand,India,Asia Pacific,,"24.1452390, 86.3349990",exact,https://www.gem.wiki/Atibir_Industries_Bhorandiha_steel_plant,16,2008,unknown,2009,unknown,unknown,unknown,unknown,680,300,300,"crude, semi-finished, finished rolled","pig iron, rolled",unknown,unknown,unknown,unknown,No,BF; BOF,3 MW WHRB,unknown,unknown,Atibir Industries Bhorandiha steel plant,,India,operating,2009,,,,,,600,600,,
P100000120512,BMM Ispat Danapur steel plant,,BMMIL,,BMM Ispat Ltd,,E100001000460,5035158229,,JSW Projects Ltd [58.5%]; natural person(s) [41.5%],E100001011472 [58.5%]; E100000123261 [41.5%],5035158115 [58.5%]; unknown [41.5%],"#114, Danapur Village, Hospete Taluk, Ballari District, Danapura – 583222, Karnataka, India",Danapura,Karnataka,India,Asia Pacific,,"15.1697200, 76.3797100",exact,https://www.gem.wiki/BMM_Ispat_Danapur_steel_plant,19,unknown,unknown,2006,unknown,unknown,unknown,unknown,2500,800,2400,semi-finished,"bar, rebar, flat",building and infrastructure,300,2024-03-14 00:00:00,unknown,No,BOF; BF; DRI; EAF; Steel other/unspecified,"Danapuram BMM power station; captive power plants totaling 235 MW (Captive Power Plant 1 95 MW, Captive Power Plant 2 140 MW).","Ballari, Hosapete, Sandur regions of Karnataka","Mozambique, Australia, and Canada",BMM Ispat Danapur steel plant,,India,operating,2006,2208,1100.0,1000,,108,1640,880,760,
P100001045282,Crest Steel and Power Mangatta Steel Plant,,,,Crest Steel and Power Pvt Ltd,,E100002007975,4298478658,,Atha Group [47.5%]; Ghanashyam Misra & Sons Pvt Ltd [47.5%],E100000134289 [47.5%]; E100002000372 [47.5%],5064283827 [47.5%]; 5064636420 [47.5%],Joratarai Village,Mangatta,Chhattisgarh,India,Asia Pacific,,"21.1903130, 81.1992200",exact,https://www.gem.wiki/Crest_Steel_and_Power_Mangatta_Steel_Plant,unknown,unknown,unknown,unknown,unknown,unknown,unknown,unknown,unknown,unknown,1400,unknown,unknown,unknown,2500,unknown,unknown,No,BF; EAF; DRI; Steel other/unspecified,16 MW CPP (8 MW WHRB-based; 8 MW FBC),unknown,SECL Mines,Crest Steel and Power Mangatta Steel Plant,,India,operating,unknown,130,,,,130,232,,232,
P100000120534,Electrosteel Bokaro steel plant,,"Electrosteel Steels Limited, ESL",,ESL Steel Ltd,,E100000130900,4298544502,,Vedanta Ltd [95.5%]; small shareholder(s) [4.5%],E100001000479 [95.5%]; E100001015587 [4.5%],4295872982 [95.5%]; unknown [4.5%],"Village: Siyaljori, PO.- Jogidih, Op.- Bangeria, PS.- Chandankyari, Dist.– Bokaro 828303, Jharkhand (INDIA)",Bokaro,Jharkhand,India,Asia Pacific,,"23.6329070, 86.2936710",exact,https://www.gem.wiki/Electrosteel_Bokaro_steel_plant,19,unknown,unknown,2006,unknown,unknown,unknown,unknown,2900,500,unknown,"crude, semi-finished, finished rolled","wire rod, bar, pipe, billet, pig iron","building and infrastructure, energy",8895,2021-06-03 00:00:00,unknown,No,BF; BOF; Steel other/unspecified,80 MW Captive power plant,Nadidihi iron ore and manganese Block Mines and Nadidihi iron ore block mines situated in Odisha.,"Australia, Russia and Indonesia",Electrosteel Bokaro steel plant,,India,operating,2006,1500,1500.0,,,,1568,1568,,
P100000121207,Electrosteel Castings Srikalahasthi Steel Plant,,Srikalahasthi Works,,Electrosteel Castings Ltd,,E100001012391,4295873171,,Electrosteel Castings Ltd [100.0%],E100001012391 [100.0%],4295873171 [100.0%],"Vill - Rachagunneri ,Mandal-Srikalahasthi, District - Tirupati, Andhra Pradesh , India, Pin - 517641",Srikalahasthi,Andhra Pradesh,India,Asia Pacific,,"13.7171880, 79.6305880",exact,https://www.gem.wiki/Electrosteel_Castings_Srikalahasthi_Steel_Plant,31,unknown,unknown,1994,unknown,unknown,unknown,,500,280,,"semi-finished, finished rolled",pipe,building and infrastructure,unknown,2023-12-10 00:00:00,unknown,No,BF; Steel other/unspecified,22 MW Waste Heat Recovery Captive Power Plant,unknown,unknown,Electrosteel Castings Srikalahasthi Steel Plant,,India,operating,1994,>0,,,,>0,575,575,,
P100000121195,Evonith Metallics Wardha Steel Plant,,Uttam Galva Metallics Limited (UGML),,Evonith Metallics Ltd,,E100001012096,5036158873,,Nithia Capital Resources Advisors LLP [55.7%]; AB CarVal Investors LP [44.3%],E100001016196 [55.7%]; E100001016198 [44.3%],5035393612 [55.7%]; 4297703173 [44.3%],"Bhugaon Link Road, Wardha, Maharashtra, India",Wardha,Maharashtra,India,Asia Pacific,,"20.7046050, 78.6202930",exact,https://www.gem.wiki/Evonith_Metallics_Wardha_Steel_Plant,31,unknown,unknown,1994,unknown,unknown,unknown,unknown,1500,>0,unknown,"crude, semi-finished","pig iron, bar",unknown,423,Yes,unknown,No,BF; BOF,34 MW Captive Power Plant,Jabalpur (60-80%) and from mines in Odisha and Karnataka,Australia,Evonith Metallics Wardha Steel Plant,,India,operating,1994,,,,,,1300,1300,,
P100000121236,Evonith Value Steel Wardha Steel Plant,,Uttam Value Steels Limited (UVSL),,Evonith Metallics Ltd,,E100001012096,5036158873,,Nithia Capital Resources Advisors LLP [55.7%]; AB CarVal Investors LP [44.3%],E100001016196 [55.7%]; E100001016198 [44.3%],5035393612 [55.7%]; 4297703173 [44.3%],"Bhugaon Link Road, Wardha, Maharashtra, India",Wardha,Maharashtra,India,Asia Pacific,,"20.6964120, 78.6385480",exact,https://www.gem.wiki/Evonith_Value_Steel_Wardha_Steel_Plant,55,unknown,unknown,1970,unknown,unknown,unknown,,,,,"semi-finished, finished rolled","flat, hot rolled, cold rolled, galvanized",unknown,898,Yes,Yes,No,EAF,unknown,unknown,unknown,Evonith Value Steel Wardha Steel Plant,,India,operating,1970,1080,,1080,,,,,,
P100001045317,Gallantt Ispat Gorakhpur steel plant,,,,Gallantt Ispat Ltd,,E100002008017,4295873649,,Gallantt Ispat Ltd [100.0%],E100002008017 [100.0%],4295873649 [100.0%],Sector 23,Gorakhpur Industrial Development Authority,Uttar Pradesh,India,Asia Pacific,,"26.7570090, 83.1990860",exact,https://www.gem.wiki/Gallantt_Ispat_Gorakhpur_steel_plant,unknown,unknown,unknown,unknown,unknown,unknown,unknown,,unknown,,unknown,unknown,unknown,unknown,unknown,unknown,unknown,No,DRI; Steel other/unspecified,78 MW CPP,unknown,unknown,Gallantt Ispat Gorakhpur steel plant,,India,operating,unknown,528,,,,528,545,,545,
P100000120557,Godawari Power and Ispat Siltara steel plant,,"Ispat Godawari (IGL), GPIL",,Godawari Power and Ispat Ltd,,E100001000665,4295874267,,Godawari Power and Ispat Ltd [100.0%],E100001000665 [100.0%],4295874267 [100.0%],"428/2, Phase-I, Industrial Area, Siltara – 493111, Dist. Raipur, Chhattisgarh, INDIA",Raipur,Chhattisgarh,India,Asia Pacific,,"21.3762140, 81.6818880",exact,https://www.gem.wiki/Godawari_Power_and_Ispat_Siltara_steel_plant,24,1999,unknown,2001,unknown,unknown,unknown,,,,2100,"crude, semi-finished, finished rolled","bloom, billet, DRI, wire",building and infrastructure,3442,Yes,unknown,No,BF; DRI; Steel other/unspecified,73 MW captive power plant,unknown,unknown,Godawari Power and Ispat Siltara steel plant,,India,operating,2001,659,,,,659,528,33,495,
P100000120552,Hospet Steels Hospet plant,,"HSL, Kalyani Steels",,Hospet Steels Ltd,,E100002004716,5000932160,,Kalyani Steels Ltd [61.0%]; Mukand Ltd [39.0%],E100000130701 [61.0%]; E100002007557 [39.0%],4295872493 [61.0%]; 4295872402 [39.0%],"Hospet, Kanakapur, Karnataka, India",Hospet,Karnataka,India,Asia Pacific,,"15.3390550, 76.2516960",exact,https://www.gem.wiki/Hospet_Steels_Hospet_plant,27,unknown,unknown,1998,unknown,unknown,unknown,unknown,500,200,unknown,"semi-finished, finished rolled","rounds, bar, billet","automotive, building and infrastructure, energy, steel packaging, tools and machinery, transport",1105,Yes,unknown,No,BOF; BF; DRI; EAF; Steel other/unspecified,unknown,unknown,unknown,Hospet Steels Hospet plant,,India,operating,1998,650,650.0,,,,700,700,,
P100000120560,Jai Balaji Durgapur Unit IV steel plant,,JBG Durgapur,,Jai Balaji Industries Ltd,,E100000130703,4295873993,,Jai Balaji Industries Ltd [100.0%],E100000130703 [100.0%],4295873993 [100.0%],"Vill – Banskopa, P.O – Rajbandh Durgapur – 713212, Burdwan, India",Durgapur,West Bengal,India,Asia Pacific,,"23.4830750, 87.3521890",exact,https://www.gem.wiki/Jai_Balaji_Durgapur_Unit_IV_steel_plant,16,2007-10-01 00:00:00,unknown,2009,unknown,unknown,unknown,unknown,unknown,350,unknown,"crude, semi-finished, finished rolled","bar, pipe, billet, rounds, pig iron, DRI",unknown,unknown,unknown,unknown,No,BF; EAF; DRI; Steel other/unspecified,70 MW CPP,unknown,unknown,Jai Balaji Durgapur Unit IV steel plant,,India,operating,2009,295,,,,295,200,80,120,
P100000120562,Jai Balaji Jyoti Steels Sundargarh plant,,,,Jai Balaji Jyoti Steels Ltd,,E100000130984,5037247687,,Jai Balaji Industries Ltd,E100000130703,4295873993,"Village-Tainser, Tehsil- Lathikata, District-Sundargarh, Odisha -770 037, India",Tainser,Odisha,India,Asia Pacific,,"22.0853380, 84.8618400",exact,https://www.gem.wiki/Jai_Balaji_Jyoti_Steels_Sundargarh_plant,22,unknown,unknown,2003,unknown,unknown,unknown,,unknown,,1600,"crude, semi-finished, finished rolled","billet, wire rod, DRI, bar",unknown,650,unknown,unknown,No,EAF; DRI; Steel other/unspecified,18 MW (State grid); 110 MW CPP (proposed),OMC mines / private mines in Barbil-Joda,"Mahanadi Coalfields, & other coal fields",Jai Balaji Jyoti Steels Sundargarh plant,,India,operating,2003,92,,,,92,120,,120,
P100001025922,Jai Balaji Rajbandh Unit III steel plant,,,,Jai Balaji Industries Ltd,,E100000130703,4295873993,,Jai Balaji Industries Ltd [100.0%],E100000130703 [100.0%],4295873993 [100.0%],unknown,Banskopa,West Bengal,India,Asia Pacific,,"23.4874390, 87.3694940",exact,https://www.gem.wiki/Jai_Balaji_Rajbandh_Unit_III_steel_plant,unknown,unknown,unknown,unknown,unknown,unknown,unknown,unknown,608,unknown,600,finished rolled,di pipe,unknown,unknown,unknown,unknown,No,BF; EAF,unknown,Barbil,unknown,Jai Balaji Rajbandh Unit III steel plant,,India,operating,unknown,,,,,,630,630,,
P100000120547,Jayaswal Neco Industries Raipur steel plant,,,,Jayaswal Neco Industries Ltd,,E100000120672,4295874276,,Jayaswal Neco Industries Ltd [100.0%],E100000120672 [100.0%],4295874276 [100.0%],"Siltara Growth Centre, Siltara, RAIPUR 493111, Chhattisgarh, India",Raipur,Chhattisgarh,India,Asia Pacific,,"21.3544950, 81.6764440",exact,https://www.gem.wiki/Jayaswal_Neco_Industries_Raipur_steel_plant,29,unknown,unknown,1996,unknown,unknown,unknown,,2800,1100,3000,"crude, semi-finished, finished rolled","bar, bloom, billet, pig iron, rolled, DRI",building and infrastructure,9503,Expired,unknown,No,BF; EAF; DRI,"Five captive power plants, combined capacity of 60MW","Metabodeli mine, Chhotedongar Mine, Dhobitola & Manegaon mine",unknown,Jayaswal Neco Industries Raipur steel plant,,India,operating,1996,1200,,1200,,,1270,1000,270,
P100000120544,Jindal Stainless Hisar steel plant,,"JSLH, JSHL, JSL Hisar",,Jindal Stainless Ltd,,E100000120686,4295873341,,Jindal Stainless Ltd [100.0%],E100000120686 [100.0%],4295873341 [100.0%],"O. P. Jindal Marg, Hisar - 125 005 (Haryana) India",Hisar,Haryana,India,Asia Pacific,,"29.1272530, 75.7730750",exact,https://www.gem.wiki/Jindal_Stainless_Hisar_steel_plant,55,unknown,unknown,1970,unknown,unknown,unknown,,,,,"semi-finished, finished rolled","plate, stainless, strip, bloom, coil, slab","automotive, building and infrastructure, energy, steel packaging, tools and machinery, transport",1095,Yes,Yes,No,EAF,unknown,,unknown,Jindal Stainless Hisar steel plant,,India,operating,1970,800,,800,,,,,,
P100000120543,Jindal Stainless Jajpur steel plant,,JSL,,Jindal Stainless Ltd,,E100000120686,4295873341,,Jindal Stainless Ltd [100.0%],E100000120686 [100.0%],4295873341 [100.0%],"Kalinga Nagar Industrial Complex, Duburi Dist., Jajpur- 755 026, Orissa, India",Kalinganagar,Odisha,India,Asia Pacific,,"20.9549390, 86.0519860",exact,https://www.gem.wiki/Jindal_Stainless_Jajpur_steel_plant,14,2003,unknown,2011,unknown,unknown,unknown,250,unknown,430,unknown,"semi-finished, finished rolled","slab, coil, plate","automotive, building and infrastructure, energy, steel packaging, tools and machinery, transport",1095,Yes,Yes,No,BF; EAF; Steel other/unspecified,2x 125 MW CPP,Barbil/Joda/open market,JCL,Jindal Stainless Jajpur steel plant,,India,operating,2011,2200,,2200,,,2000,2000,,
P100000120515,JSPL Angul steel plant,,,,Jindal Steel & Power Ltd,,E100001000439,4295874065,,Jindal Steel & Power Ltd [100.0%],E100001000439 [100.0%],4295874065 [100.0%],"Chhendipada Road, SH-63, Jindal Nagar, Angul, Odisha 759111, India",Angul,Odisha,India,Asia Pacific,,"20.8848960, 84.9915390",exact,https://www.gem.wiki/JSPL_Angul_steel_plant,12,unknown,unknown,2013,unknown,unknown,unknown,unknown,5000,unknown,unknown,"semi-finished, finished rolled","bar, plate","automotive, building and infrastructure, energy, transport",unknown,Expired,unknown,No,BF; BOF; EAF; DRI,"Angul Steel power station, a 810 MW captive power plant","Captive iron ore mines at Tensa, Odisha with production capacity of 3.11 MTPA","Mozambique, Australia and Canada",JSPL Angul steel plant,,India,operating,2013,6000,3500.0,2500,,,6050,4250,1800,
P100000120516,JSPL Raigarh steel plant,,JSPL Raigarh steel plant,,Jindal Steel & Power Ltd,,E100001000439,4295874065,,Jindal Steel & Power Ltd [100.0%],E100001000439 [100.0%],4295874065 [100.0%],"JSPL Post Box No. 16, Kharsia Road, Raigarh, Chhattisgarh 496001, India",Raigarh,Chhattisgarh,India,Asia Pacific,,"21.9227030, 83.3471780",exact,https://www.gem.wiki/JSPL_Raigarh_steel_plant,36,unknown,unknown,1989,unknown,unknown,unknown,60,2850,800,unknown,"semi-finished, finished rolled","billet, coil, rail, beam","building and infrastructure, transport",2652,Yes,Yes,No,BF; BOF; EAF; DRI,"Dongamahua Captive Power Plant; 354 MW captive power plant at Raigarh and 540 MW captive power plant at Dongamauhu, district Raigarh, Chhattisgarh.",Iron ore in Orissa - not clear if it's captive,Australia,JSPL Raigarh steel plant,,India,operating,1989,3600,,3600,,,4370,3050,1320,
P100000120510,JSW BPSL Jharsuguda steel plant,,"JSW Odisha steel plant, Bhushan Power and Steel (BPSL)",,JSW Steel Ltd,,E100001000516,4295872888,Partial,JSW Steel Ltd [100.0%],E100001000516 [100.0%],4295872888 [100.0%],"Thelkoloi, Lapanga PO",Thelkoloi,Odisha,India,Asia Pacific,,"21.7639890, 84.0225290",exact,https://www.gem.wiki/JSW_BPSL_Jharsuguda_steel_plant,20,unknown,unknown,2005,unknown,unknown,unknown,unknown,>0,950,3500,"crude, semi-finished, finished rolled","wire rod, sheet, pipe, billet, coil, pig iron, rounds, hot rolled, DRI","automotive, building and infrastructure, energy, steel packaging, tools and machinery",929,Yes,unknown,No,BF; EAF; DRI; Steel other/unspecified,Captive power plant (506 MW). Excess power generated is sold thorugh state power grid.,Netrabandha iron ore mine,Indian and imported from South Africa,JSW BPSL Jharsuguda steel plant,,India,operating,2005,5000,,3500,,1500,4270,2350,1920,
P100000120570,JSW Green Steel Salav plant,,"Vikram Ispat (formerly), Welspun Maxsteel (formerly)",,JSW Green Steel Ltd,,E100002016710,5093571666,,JSW Green Steel Ltd [100.0%],E100002016710 [100.0%],5093571666 [100.0%],"Salav, taluka Murud, district Raigad, Maharashtra, India",Salav,Maharashtra,India,Asia Pacific,,"18.5308530, 72.9470910",exact,https://www.gem.wiki/JSW_Steel_Salav_DRI_plant,32,unknown,unknown,1993,unknown,unknown,unknown,unknown,unknown,,>0,crude,"HBI, DRI",unknown,297,unknown,unknown,No,Iron other/unspecified; EAF; DRI,unknown,unknown,unknown,JSW Green Steel Salav plant,,India,operating,1993,,,,,,1000,,1000,
P100000120517,JSW Steel Dolvi steel plant,,Dolvi Works,,JSW Steel Ltd,,E100001000516,4295872888,Partial,JSW Steel Ltd [100.0%],E100001000516 [100.0%],4295872888 [100.0%],"Dharamtar, Taluka Pen, Dolvi, Maharashtra 402107, India",Dolvi,Maharashtra,India,Asia Pacific,,"18.6903120, 73.0359020",exact,https://www.gem.wiki/JSW_Steel_Dolvi_steel_plant,31,unknown,unknown,1994,unknown,unknown,unknown,unknown,5100,3000,8000,"semi-finished, finished rolled","galvanized, wire rod, bar, cold rolled, special, hot rolled","automotive, building and infrastructure, energy, steel packaging, tools and machinery, transport",929,unknown,unknown,No,BF; BOF; EAF; DRI,55 MW power plant (2013); 300 MW CPP,Anglo American Mines at Brazil,China,JSW Steel Dolvi steel plant,,India,operating,1994,10200,5000.0,5200,,,10100,8100,2000,
P100000120536,JSW Steel Raigarh steel plant,,"JISPL Raigarh, Monnet Ispat & Energy Limited Raigarh, JSW Ispat Special Products Raigarh steel plant (formerly)",,JSW Ispat Special Products Ltd,,E100000120868,4295873687,,JSW Ispat Special Products Ltd [100.0%],E100000120868 [100.0%],4295873687 [100.0%],"Village & Post - Naharpalli, Tehsil - Kharsia, Raigarh 496661, Chhattisgarh, India",Raigarh,Chhattisgarh,India,Asia Pacific,,"21.9837090, 83.2381330",exact,https://www.gem.wiki/JSW_Steel_Raigarh_steel_plant,17,unknown,unknown,2008,unknown,unknown,unknown,220,960,unknown,2200,"semi-finished, finished rolled","rebar, pellets, plate, sponge iron, billet, pig iron, hot rolled, profile","automotive, building and infrastructure, tools and machinery, transport",1052,Yes,unknown,No,BF; EAF; DRI,Captive power plant (174 MW),JSWSL's mines,imports,JSW Steel Raigarh steel plant,,India,operating,2008,950,,950,,,1282,700,582,
P100000120518,JSW Steel Salem steel plant,,,,JSW Steel Ltd,,E100001000516,4295872888,Partial,JSW Steel Ltd [100.0%],E100001000516 [100.0%],4295872888 [100.0%],"Pottaneri, M. Kalipatti Village, Salem, Tamil Nadu 636453, India",Pottaneri,Tamil Nadu,India,Asia Pacific,,"11.8149120, 77.9184650",exact,https://www.gem.wiki/JSW_Steel_Salem_steel_plant,27,1991,1996,1998,unknown,unknown,unknown,unknown,1235,500,unknown,"semi-finished, finished rolled","wire rod, square, bar, coil, flat, hot rolled","automotive, building and infrastructure, energy, steel packaging, tools and machinery, transport",929,Yes,unknown,No,BF; BOF,3x 30MW CPP (More than 70% of captive power generation through waste heat),Captive mines in Odisha (unknown what percentage comes from here),Imported,JSW Steel Salem steel plant,,India,operating,1998,1260,1260.0,,,,1366,1366,,
P100000120519,JSW Steel Vijayanagar steel plant,,"JSW Karnataka steel plant, JSW Steel Toranagallu, JVSL, Vijayanagar Works",,JSW Steel Ltd,,E100001000516,4295872888,Partial,JSW Steel Ltd [100.0%],E100001000516 [100.0%],4295872888 [100.0%],"Sandur Taluk, Vijyanagar Post, Bellary, Toranagallu, Karnataka 583275, India",Toranagallu,Karnataka,India,Asia Pacific,,"15.1804230, 76.6631340",exact,https://www.gem.wiki/JSW_Steel_Vijayanagar_steel_plant,31,unknown,unknown,1994,unknown,unknown,unknown,unknown,12950,6500,9200,"semi-finished, finished rolled","galvanized, wire rod, bar, cold rolled, special, hot rolled",building and infrastructure,929,unknown,unknown,No,Iron other/unspecified; BOF; BF; DRI; EAF,"JSW Vijayanagar Toranagallu power station; 860MW power plant in Vijaynagar consisting of 2 130MW units in SBU I (2000) and 2 300MW units in SBU II (2009), 76 MW captive power plant. Also recycles 96% of coke oven gas for power generation.",Captive mines in Odisha and Karnataka,unknown,JSW Steel Vijayanagar steel plant,,India,operating,1994,11899,10399.0,1500,,,11400,8500,1200,1700
P100000120538,JSW Vijayanagar Metallics steel plant,,"VML, JVML",,JSW Vijayanagar Metallics Ltd,,E100001000529,5080153250,Partial,JSW Steel Ltd [100.0%],E100001000516 [100.0%],4295872888 [100.0%],"Sandur Taluk, Vijyanagar Post, Bellary, Toranagallu, Karnataka 583275, India",Toranagallu,Karnataka,India,Asia Pacific,,"15.2031760, 76.6591220",approximate,https://www.gem.wiki/JSW_Vijayanagar_Metallics_steel_plant,1,2019-12-24 00:00:00,2022-01-07 00:00:00,2024,unknown,unknown,unknown,unknown,5750,unknown,unknown,finished rolled,hot rolled,unknown,990,unknown,unknown,No,BF; BOF,unknown,unknown,unknown,JSW Vijayanagar Metallics steel plant,,India,operating,2024,3300,3300.0,,,,4500,4500,,
P100001045284,KIC Metaliks Durgapur steel plant,,,,KIC Metaliks Ltd,,E100002007981,4295873610,,KIC Metaliks Ltd [100.0%],E100002007981 [100.0%],4295873610 [100.0%],Raturia Industrial Area,Durgapur,West Bengal,India,Asia Pacific,,"23.507539, 87.277914",exact,https://www.gem.wiki/KIC_Metaliks_Durgapur_steel_plant,27.61,unknown,unknown,1998-02-01 00:00:00,unknown,unknown,unknown,unknown,360,unknown,unknown,unknown,unknown,unknown,421,unknown,unknown,No,BF; EAF; DRI; Steel other/unspecified,4.7 MW WHRB CPP,unknown,unknown,KIC Metaliks Durgapur steel plant,,India,operating,1998-02-01 00:00:00,,,,,,235,235,,
