P100000121231,Mughal Iron & Steel Industries Lahore plant,,,,Mughal Iron & Steel Industries Ltd,,E100001011285,5044735156,,Mughal Iron & Steel Industries Ltd [100.0%],E100001011285 [100.0%],5044735156 [100.0%],"17 km Sheikupura Road, Lahore, Pakistan",Lahore,Punjab,Pakistan,Asia Pacific,,"31.6530350, 74.1831490",exact,https://www.gem.wiki/Mughal_Iron_&_Steel_Industries_Lahore_plant,26,unknown,unknown,1999,unknown,unknown,unknown,,,,,"semi-finished, finished rolled","billet, beam, bar","building and infrastructure, energy",2250,unknown,unknown,No,Steel other/unspecified,20MW CPP,unknown,unknown,Mughal Iron & Steel Industries Lahore plant,,Pakistan,operating,1999,583,,,,583,,,,
P100000120768,Aceros Arequipa Pisco steel plant,Planta siderúrgica de Pisco,,,Corporacion Aceros Arequipa SA,,E100000130730,4295886029,,Corporacion Aceros Arequipa SA [100.0%],E100000130730 [100.0%],4295886029 [100.0%],"Carretera Panamericana Sur Km 241. Paracas. Pisco - Ica, Peru",Pisco,Ica,Peru,Central & South America,,"-13.7886220, -76.1681730",exact,https://www.gem.wiki/Aceros_Arequipa_Pisco_steel_plant,38,unknown,unknown,1987,unknown,unknown,unknown,,unknown,,unknown,finished rolled,"wire rod, plate, bar, rounds, round bar, angle, structures","building and infrastructure, tools and machinery, transport",720,2023-11-29 00:00:00,unknown,No,EAF; DRI,unknown,unknown,unknown,Aceros Arequipa Pisco steel plant,Planta siderúrgica de Pisco,Peru,operating,1987,1250,,1250,,,,,,
P100000120769,Gerdau Siderperu Chimbote steel plant,Planta siderúrgica Gerdau Siderperu Chimbote,,Empresa Siderúrgica del Perú,Empresa Siderurgica del Peru SAA,,E100000130731,4295886075,,Empresa Siderurgica del Peru SAA [100.0%],E100000130731 [100.0%],4295886075 [100.0%],Av. Santiago Antúnez de Mayolo s/n,Chimbote,Áncash,Peru,Central & South America,,"-9.0596930, -78.6011780",exact,https://www.gem.wiki/Gerdau_Siderperu_Chimbote_steel_plant,67,unknown,unknown,1958,unknown,unknown,unknown,unknown,unknown,unknown,unknown,finished rolled,"rebar, mesh, bar","building and infrastructure, energy, tools and machinery, transport",774,2024-02-01 00:00:00,unknown,No,BF; EAF; DRI,"Enel Perú and SIDERPERU, a Gerdau company, signed a 12-year energy supply contract through which the electricity company will supply energy from its renewable plants to the operation of the steel mill. This alliance, which will last for more than a decade, involves part of the energy that will be produced by Enel's next non-conventional renewable energy plants: Wayra Extension wind power plant and Clemesi solar plant.",unknown,unknown,Gerdau Siderperu Chimbote steel plant,Planta siderúrgica Gerdau Siderperu Chimbote,Peru,operating,1958,750,,750,,,,,,
P100000120772,SteelAsia Calaca plant,,"Calaca Works, M3, SAMC Calaca",,SteelAsia Manufacturing Corp,,E100000131011,5041063881,,SteelAsia Manufacturing Corp [100.0%],E100000131011 [100.0%],5041063881 [100.0%],"Phoneix Petroterminal & Industrial Park, Calaca Batangas, Region 4A (Southern Luzon), Philippines",Calaca Batangas,Southern Luzon,Philippines,Asia Pacific,,"13.9223460, 120.8237960",exact,https://www.gem.wiki/SteelAsia_Calaca_plant,26,unknown,unknown,1999,unknown,unknown,unknown,,,,,"semi-finished, finished rolled","rebar, billet",building and infrastructure,800,Yes,unknown,No,EAF,unknown,unknown,unknown,SteelAsia Calaca plant,,Philippines,operating,1999,500,,500,,,,,,
P100000120773,SteelAsia Compostela steel plant,,"SAMC Cebu (Compostela), SAMC Compostela",,SteelAsia Manufacturing Corp,,E100000131011,5041063881,,SteelAsia Manufacturing Corp [100.0%],E100000131011 [100.0%],5041063881 [100.0%],"P. Cabatingan St., Poblacion, Compostela, Cebu, Philippines",Compostela,Cebu,Philippines,Asia Pacific,,"10.4507800, 124.0064240",exact,https://www.gem.wiki/SteelAsia_Compostela_steel_plant,2,2018-03-13 00:00:00,2019,2023,unknown,unknown,unknown,,,,,finished rolled,rebar,building and infrastructure,3000,unknown,unknown,No,EAF,unknown,unknown,unknown,SteelAsia Compostela steel plant,,Philippines,operating,2023,1000,,1000,,,,,,
P100000120785,ArcelorMittal Dąbrowa Górnicza steel plant,Oddział w Dąbrowie Górniczej,"Huta Katowice, Katowice Steelworks, Mittal Steel Poland (predecessor), Ispat Polska Stal S.A. (predecessor), Polskie Huty Stali S.A. (predecessor)",,ArcelorMittal Poland SA,,E100001000503,5000013933,,ArcelorMittal SA [100.0%],E100000000687 [100.0%],5000030092 [100.0%],"Al. J. Piłsudskiego 92, 41-308 Dąbrowa Górnicza, Poland",Dabrowa Gornicza,Silesia,Poland,Europe,,"50.3424170, 19.2850370",exact,https://www.gem.wiki/ArcelorMittal_Dąbrowa_Górnicza_steel_plant,49,unknown,unknown,1976,unknown,unknown,unknown,0,>0,>0,0,"crude, semi-finished, finished rolled","wire rod, rail, sections, coke, piling",unknown,8800,2024-08-11 00:00:00,2022-08-19 00:00:00,2022-08-01 00:00:00,BF; BOF,unknown,unknown,"ArcelorMittal Kraków steel plant, which has been closed, but continued to operate coke ovens.",ArcelorMittal Dąbrowa Górnicza steel plant,Oddział w Dąbrowie Górniczej,Poland,operating,1976,5001,5001.0,,,,4500,4500,,
P100000120790,ArcelorMittal Warszawa steel plant,,Huta Lucchini-Warszawa,,Arcelormittal Warszawa SP zoo,,E100001000506,4296541979,,ArcelorMittal SA [100.0%],E100000000687 [100.0%],5000030092 [100.0%],"Kasprowicza 132, 01-949 Warszawa, Poland",Warszawa,Mazowieckie,Poland,Europe,,"52.2913370, 20.9173020",exact,https://www.gem.wiki/ArcelorMittal_Warszawa_steel_plant,68,unknown,unknown,1957,unknown,unknown,unknown,,,,,"crude, semi-finished, finished rolled","ingot, billet, bar","automotive, building and infrastructure, tools and machinery",535,2022,2023,2022-08-01 00:00:00,EAF,"""The proportion of the electricity demand covered by green electricity in the total electricity demand of the on-site production at Warszawa is 100%.""",unknown,unknown,ArcelorMittal Warszawa steel plant,,Poland,operating,1957,750,,750,,,,,,
P100000120788,Celsa Huta Ostrowiec steel plant,,,,Celsa Huta Ostrowiec SP zoo,,E100000130982,5037055114,,Anchorage Capital Advisors LP; Anchorage Capital Group LLC; Attestor Services Ltd; Deutsche Bank AG; GoldenTree Asset Management LP; Midwood Holdings LLC,E100002003621; E100002003627; E100002003626; E100000136992; E100002003622; E100002003624,5087215566; 5000008410; 5061209241; 4295869482; 5000034523; 5064670557,"ul. Samsonowicza 2, 27-400 Ostrowiec Swietokrzski, Poland",Ostrowiec Swietokrzski,Świętokrzyskie,Poland,Europe,,"50.9473050, 21.4487630",exact,https://www.gem.wiki/Celsa_Huta_Ostrowiec_steel_plant,212,unknown,unknown,1813,unknown,unknown,unknown,,,,,finished rolled,"rebar, beam, bar",building and infrastructure,1804,2021,unknown,No,EAF,unknown,unknown,unknown,Celsa Huta Ostrowiec steel plant,,Poland,operating,1813,900,,900,,,,,,
P100000120787,CMC Zawiercie steel plant,,,,CMC Poland SP zoo,,E100000131004,5040275344,,Commercial Metals Co [100.0%],E100000130754 [100.0%],4295903763 [100.0%],"ul. Pilsudskiego 82, Zawiercie 42-400, Poland",Zawiercie,Silesia,Poland,Europe,,"50.4874630, 19.4567590",exact,https://www.gem.wiki/CMC_Zawiercie_steel_plant,124,unknown,unknown,1901,unknown,unknown,unknown,,,,,finished rolled,"rod, coil, angle, bar","automotive, building and infrastructure, energy, steel packaging, tools and machinery, transport",2000,2023-09-30 00:00:00,N,No,EAF,Polish power producer PGE Obrót has concluded a contract for the sale of energy with CMC Poland in Poland.,unknown,unknown,CMC Zawiercie steel plant,,Poland,operating,1901,1700,,1700,,,,,,
P100000120792,Ferrostal Labedy Gliwice steel plant,,Cognor Group Gliwice,,Ferrostal Labedy SP zoo,FERROSTAL ŁABĘDY,E100000130875,4298239322,,Ferrostal Labedy SP zoo [100.0%],E100000130875 [100.0%],4298239322 [100.0%],"44-109 Gliwice, Anny Jagiellonki Street 47, Poland",Gliwice,Śląskie,Poland,Europe,,"50.3574380, 18.6107390",exact,https://www.gem.wiki/Ferrostal_Labedy_Gliwice_steel_plant,32,unknown,unknown,1993,unknown,unknown,unknown,,,,,"crude, semi-finished, finished rolled","ingot, bar, hot rolled","automotive, building and infrastructure, energy, tools and machinery",81,2022-07-16 00:00:00,N,No,EAF,unknown,unknown,unknown,Ferrostal Labedy Gliwice steel plant,,Poland,operating,1993,500,,500,,,,,,
P100000120789,Huta Czestochowa steel plant,Liberty Częstochowa,"ISD Huta Czestochowa steel plant, Liberty Czestochowa steel plant",,Liberty Steel Group,,E100000130950,5076098979,,GFG Alliance Ltd,E100001000556,5057811578,"Ludwika Trochimowskiego 25, 42-200 Częstochowa, Poland",Częstochowa,Silesia,Poland,Europe,,"50.7826140, 19.1655660",exact,https://www.gem.wiki/Huta_Czestochowa_steel_plant,123,unknown,unknown,1902,unknown,unknown,unknown,,,,,semi-finished,plate,"building and infrastructure, energy, tools and machinery, transport",950,Yes,Yes,No,EAF,unknown,unknown,unknown,Huta Czestochowa steel plant,Liberty Częstochowa,Poland,operating,1902,840,,840,,,,,,
P100000120794,SN MAIA Siderurgia Nacional steel plant,,Megasa Maia steel plant,,SN MAIA Siderurgia Nacional SA,,E100000131054,5060000448,,Bipadosa SL,E100001016222,5059986377,"RUA DA SIDERURGIA 4425-393, MAIA Portugal",Maia,Porto,Portugal,Europe,,"41.2550850, -8.5552850",exact,https://www.gem.wiki/SN_MAIA_Siderurgia_Nacional_steel_plant,51,unknown,unknown,1974,unknown,unknown,unknown,,,,,"semi-finished, finished rolled",rebar,unknown,296,Yes,Yes,No,EAF,unknown,unknown,unknown,SN MAIA Siderurgia Nacional steel plant,,Portugal,operating,1974,600,,600,,,,,,
P100000120793,SN SEIXAL Siderurgia Nacional steel plant,,Megasa Seixal steel plant,,SN SEIXAL Siderurgia Nacional SA,,E100000130888,4298309429,,Bipadosa SL,E100001016222,5059986377,"Avenida Siderurgia Nacional, Paio Pires, 2840-075 Aldeia de Paio Pires, Portugal",Aldeia de Paio Pires,Setúbal,Portugal,Europe,,"38.6160230, -9.0685270",exact,https://www.gem.wiki/SN_SEIXAL_Siderurgia_Nacional_steel_plant,64,unknown,unknown,1961,unknown,unknown,unknown,,,,,"semi-finished, finished rolled","coil, wire, mesh, bar",unknown,400,2024-06-30 00:00:00,2022-12-13 00:00:00,No,EAF,unknown,unknown,unknown,SN SEIXAL Siderurgia Nacional steel plant,,Portugal,operating,1961,1100,,1100,,,,,,
P100000120795,Industries Qatar Steel Mesaieed plant,قطر ستيل,"Qasco, QPSC",,Qatar Steel Company QPSC,,E100001000958,5000010731,Partial,Industries Qatar QPSC [100.0%],E100000000840 [100.0%],4295886945 [100.0%],"Qatar Steel Company (QPSC), P.O. Box 50090, Mesaieed Industrial City, Mesaieed, State of Qatar",Mesaieed Industrial City,Mesaieed,Qatar,Middle East,,"24.9526880, 51.5847770",exact,https://www.gem.wiki/Industries_Qatar_Steel_Mesaieed_plant,47,1974,unknown,1978,unknown,unknown,unknown,,unknown,,unknown,"crude, semi-finished, finished rolled","HBI, wire rod, rebar, billet, coil, DRI",unknown,1072,2021,unknown,No,EAF; DRI,unknown,unknown,unknown,Industries Qatar Steel Mesaieed plant,قطر ستيل,Qatar,operating,1978,2574,,2574,,,1700,,1700,
P100000120797,ArcelorMittal Hunedoara steel plant,,,,ArcelorMittal Hunedoara SA,,E100001000499,4296775956,,ArcelorMittal Hunedoara SA [100.0%],E100001000499 [100.0%],4296775956 [100.0%],"DJ 687-Nr. 4 Hunedoara, code 331 111, jud. Hunedoara, Romania",Hunedoara,Hunedoara,Romania,Europe,,"45.7351830, 22.9162700",exact,https://www.gem.wiki/ArcelorMittal_Hunedoara_steel_plant,141,unknown,unknown,1884,unknown,unknown,unknown,,,,,finished rolled,profile,"building and infrastructure, energy",582,2024-03-05 00:00:00,2022-11-15 00:00:00,No,EAF,unknown,unknown,unknown,ArcelorMittal Hunedoara steel plant,,Romania,operating,1884,800,,800,,,,,,
P100000120798,GLGH Resita steel plant,,"Resita Iron & Steel Works, Integrated Iron and Steel Resita, TMK Resita (predecessor), Artrom Plant No. 2, Artrom Resita steel plant",,GLGH Steel,,E100002016547,unknown,,GLGH Steel [100.0%],E100002016547 [100.0%],unknown [100.0%],"Traian Lalescu Street, No. 36, 320050, Resita, Caras-Severin, Romania",Resita,Caras-Severin,Romania,Europe,,"45.2934920, 21.9024100",exact,https://www.gem.wiki/Artrom_Resita_steel_plant,254,unknown,unknown,1771,unknown,unknown,unknown,,,,,semi-finished,"bloom, billet","automotive, building and infrastructure, energy, tools and machinery",732,2024-08-01 00:00:00,N,No,EAF,"41% renewable; EAF ""directly connected to the transmission lines of TRANSELECTRICAthrough the company's own power lines""",unknown,unknown,GLGH Resita steel plant,,Romania,operating,1771,500,,500,,,,,,
P100000121242,Tenaris Silcotub Calarasi steel mill,Silcotub Călărași,Donasid,,S.C. Silcotub SA,,E100001012897,4296164392,,Tenaris SA [100.0%],E100000000692 [100.0%],4295883040 [100.0%],"162 Prelungirea Bucuresti Rd 910153 Călărași, Romania",Călărași,Județul Călărași,Romania,Europe,,"44.2172750, 27.2996800",exact,https://www.gem.wiki/Tenaris_Silcotub_Calarasi_steel_mill,21,unknown,unknown,2004,unknown,unknown,unknown,,,,,semi-finished,"bloom, billet",unknown,908,unknown,unknown,No,EAF,Installing 20 MW solar,unknown,unknown,Tenaris Silcotub Calarasi steel mill,Silcotub Călărași,Romania,operating,2004,535,,535,,,,,,
P100000120802,Abinsk Electric Steel Works,АЭМЗ,"ASW, AEMZ, AESW, AEMK",Абинский ЭлектроМеталлургический завод,Abinski Elektrometallurgicheski Zavod LLC,"ООО ""АБИНСКИЙ ЭЛЕКТРОМЕТАЛЛУРГИЧЕСКИЙ ЗАВОД""",E100000130999,5039667129,,Novostal-M LLC [100.0%],E100000131027 [100.0%],5046391773 [100.0%],"Promyshlennaya, 4, Abinsk, Krasnodarskiy Kray, 353320, Russia",Abinsk,Krasnodar,Russia,Eurasia,"353320, Российская Федерация, Краснодарский Край, г. Абинск, ул. Промышленная, д. 4","44.8819380, 38.1275100",exact,https://www.gem.wiki/Abinsk_Electric_Steel_Works,11,unknown,2008,2014,unknown,unknown,unknown,,,,,"semi-finished, finished rolled","wire rod, rebar, bar, billet, round bar, wire",unknown,4500,2022-05-24 00:00:00,unknown,No,EAF,unknown,unknown,unknown,Abinsk Electric Steel Works,АЭМЗ,Russia,operating,2014,1550,,1550,,,,,,
P100000120803,Amurstal steel plant,ООО Амурметалл-Литьё,"Amurmetall, ООО Amurmetall-Lite",Металлургический завод Амурсталь,Amurstal LLC,"ООО ""АМУРСТАЛЬ""",E100000131092,5081151437,,Armada JSC [100.0%],E100000131146 [100.0%],unknown [100.0%],"Vagonnaya Ulitsa 30, Komsomolsk-on-Amur, Khabarovsk Territory, Russia, 681000",Komsomolsk-on-Amur,Khabarovsk,Russia,Eurasia,"681000, Российская Федерация, Хабаровский край, г. Комсомольск-на-Амуре, ул. Вагонная, д. 30","50.5631310, 136.9763620",exact,https://www.gem.wiki/Amurstal_steel_plant,83,1935,1936,1942,unknown,unknown,unknown,,,,,"semi-finished, finished rolled","ingot, wire rod, rebar, bar, billet, round bar, wire",building and infrastructure,2933,unknown,unknown,No,EAF; DRI,unknown,unknown,unknown,Amurstal steel plant,ООО Амурметалл-Литьё,Russia,operating,1942,1150,,1150,,,,,,
P100000120825,Ashinskiy Metallurgical plant,ПАО «Ашинский метзавод»,"Ashinskiy Metzavod, AMZ, Ashinsky Metallurgical Works, Amet","Ашинский металлургический завод, АМЗ, Амет",Ashinskiy Metzavod PJSC,"ПАО ""Ашинский метзавод""",E100000130738,4295887190,,Ural-VK JSC [100.0%],E100002016553 [100.0%],5090089233 [100.0%],"Ulitsa Mira, 9, Asha, Chelyabinsk Oblast, Russia, 456010",Asha,Chelyabinsk,Russia,Eurasia,"456012, Российская Федерация, Челябинская область, г. Аша, ул. Мира, д. 9","54.9948400, 57.2775480",exact,https://www.gem.wiki/Ashinskiy_Metallurgical_plant,125,unknown,1898,1900,unknown,unknown,unknown,unknown,unknown,unknown,unknown,"crude, semi-finished, finished rolled","ingot, slab, cold rolled, hot rolled","automotive, energy, tools and machinery, transport",4055,unknown,unknown,No,EAF,The plant has its own power station built in 2004,unknown,unknown,Ashinskiy Metallurgical plant,ПАО «Ашинский метзавод»,Russia,operating,1900,1000,,1000,,,,,,
P100000120817,Balakovo Steel Plant,Металлургический завод Балаково,"Severstal-Sortovoi Zavod Balakovo AO (predecessor), Balakovo Steel Works JSC, Mini-Mill Balakovo, MZ Balakovo, AO, Severstal Balakovo (predecessor), Balakovo Metallurgical Plant","АО Северсталь-Сортовой Завод Балаково (predecessor, Russian)",MZ Balakovo JSC,,E100000131126,5035751397,,Novostal-M LLC,E100000131027,5046391773,"2, Metallurgov shosse, Bykov Otrog, Balakovo district, Saratov Region, Russia, 413810",Bykov Otrog,Saratov,Russia,Eurasia,"413860, Российская Федерация, Саратовская область, Быково-Отрогское муниципальное образование, ш. Металлургов, 2","51.9360090, 47.8159100",exact,https://www.gem.wiki/Balakovo_Steel_Plant,12,unknown,2008,2013,unknown,unknown,unknown,,,,,"semi-finished, finished rolled","rebar, rod, billet, channel, angle, rail, square","building and infrastructure, transport",2600,2022-06-21 00:00:00,unknown,No,EAF,unknown,unknown,unknown,Balakovo Steel Plant,Металлургический завод Балаково,Russia,operating,2013,1250,,1250,,,,,,
P100000120811,Evraz NTMK steel plant,"НТМЗ (predecessor, Russian)","NTMZ (predecessor), JSC Evraz Nizhny Tagil Metallurgical Plant, Novo-Tagil Metallurgical Plant (predecessor), Nizhny Tagil Iron & Steel Works","ЕВРАЗ Нижнетагильский металлургический комбинат, Ново-Тагильский металлургический завод (predecessor, Russian), ЕВРАЗ НТМК",Evraz NTMK JSC,"АО ""ЕВРАЗ НТМК""",E100001010326,4295886995,,EVRAZ PLC [100.0%],E100001000663 [100.0%],5036227579 [100.0%],"1 Metallurgov street, Nizhnij Tagil, Sverdlovsk oblast, Russia, 622025",Nizhnij Tagil,Sverdlovsk,Russia,Eurasia,"622025, Российская Федерация, Свердловская обл.асть, г. Нижний Тагил, ул. Металлургов, д. 1","57.9228510, 60.0335430",exact,https://www.gem.wiki/Evraz_NTMK_steel_plant,85,unknown,unknown,1940,unknown,unknown,unknown,unknown,,2300,,"semi-finished, finished rolled","structural, rail, pipe, billet, slab, beam, profile","automotive, building and infrastructure, tools and machinery, transport",13523,2023,2023-12-19 00:00:00,No,BF; BOF,unknown,"Kachkanar titanomagnetite ore deposit; development of the deposit is performed by EVRAZ KGOK, which produces pellets and sinter",unknown,Evraz NTMK steel plant,"НТМЗ (predecessor, Russian)",Russia,operating,1940,4400,4400.0,,,,5050,5050,,
P100000120822,Evraz ZSMK steel plant,ЗСМК,"West Siberian Iron & Steel, ZSMK, NKMK, Novokuznetsk Iron and Steel Works, Kuznetsk Iron and Steel Works","Кузнецкий металлургический завод (predecessor), Новокузнецкий металлургический комбинат, НКМК, Западно-Сибирский металлургический комбинат, Металлургический комбинат ЕВРАЗ ЗСМК , ОАО ""ЕВРАЗ Объединенный Западно-Сибирский металлургический комбинат"", Новокузнецкий металлургический комбинат (до 2003 года Кузнецкий металлургический комбинат)",Evraz ZSMK JSC,"ЗСMK, Западно-Сибирский металлургический комбинат",E100001010327,5000037548,,EVRAZ PLC [100.0%],E100001000663 [100.0%],5036227579 [100.0%],"Kosmicheskoye Shosse, 16, Novokuznetsk, Kemerovskaya oblast, Russia, 654042",Novokuznetsk,Kemerovskaya,Russia,Eurasia,"654042, Российская Федерация, Кемеровская область, г. Новокузнецк, Космическое шоссе, 16","53.8861800, 87.2576180",exact,https://www.gem.wiki/Evraz_ZSMK_steel_plant,93,unknown,1929,1932,unknown,unknown,unknown,unknown,7200,5210,unknown,"semi-finished, finished rolled","shapes, wire rod, rail, rebar, bar, billet, coil, slab, beam, pig iron","building and infrastructure, transport",22507,2023,2023,No,BF; BOF; EAF,Zapadno-Sibirskaya power station,"Evrazruda (Tashtagol mine, Gorno-Shorskaya mine, Kazskaya mine); Горнорудный филиал ЕВРАЗ ЗСМК (шахта «Таштагольская»; шахта «Шерегешская»; шахта «Казская»)",Alardinskaya coal mine,Evraz ZSMK steel plant,ЗСМК,Russia,operating,1932,8760,6560.0,2200,,,6200,6200,,
P100000120806,IMH Tula steel plant,"Тула-Сталь (Russian, steel only)","Tulachermet JSC, PAO Tulaсhermet, Novotulsky Metallurgical Plant (predecessor), Promsort-Tula, Tulaсhermet Steel (steel producer)","ЛПК (литейно-прокатный комплекс), Новотульский металлургический завод (НТМЗ) (Russian, predecessor), Металлургический завод Тулачермет (Russian, crude iron only), ПАО Тулачермет, Тулачермет-Сталь (Russian, steel only), ООО Тулачермет-Сталь (Russian, steel only)",Promsort LLC,"ООО ""Промсорт""",E100001012220,5083831360,,natural person(s) [50.0%]; Sortoprokat-Tsentr LLC [49.0%]; small shareholder(s) [1.0%],E100000123261 [50.0%]; E100001016121 [49.0%]; E100001015587 [1.0%],unknown [50.0%]; unknown [49.0%]; unknown [1.0%],"Przhevalskogo street, 2, Tula, Russia, 300016",Tula,Tula,Russia,Eurasia,"300016, Российская Федерация, Тульская область, Тула, ул. Пржевальского, д. 2","54.1567260, 37.7255510",exact,https://www.gem.wiki/IMH_Tula_steel_plant,90,1931,1931,1935,unknown,unknown,unknown,unknown,3400,unknown,unknown,"semi-finished, finished rolled","billet, wire rod, rebar, channel, angle",tools and machinery,6652,2022,unknown,No,BF; BOF,Tulachermet PBS power station,Korobkovskoye iron ore field,unknown,IMH Tula steel plant,"Тула-Сталь (Russian, steel only)",Russia,operating,1935,2000,2000.0,,,,7746,7746,,
P100000120830,Kamsky Metallurgical Works TEMPO,Камский металлургический комбинат ТЭМПО,"Kamsky Iron and Steel Works TEMPO, Kamsky Metallurgical Combine TEMPO","АО ""КМК ""ТЭМПО"", ТЭМПО, Камский металлургический комбинат, АО",KMK Tempo JSC,"АО ""КМК ""ТЭМПО""",E100000131099,unknown,,KMK Tempo JSC [100.0%],E100000131099 [100.0%],unknown [100.0%],"Motornaya Ulitsa, 38, Naberezhnye Chelny, Republic of Tatarstan, Russia, 423800",Naberezhnye Chelny,Republic of Tatarstan,Russia,Eurasia,"423800, Российская Федерация, Республика Татарстан, г. Набережные Челны, ул. Моторная, д. 38","55.7268720, 52.5358540",approximate,https://www.gem.wiki/Kamsky_Metallurgical_Works_TEMPO,9,unknown,unknown,2016,unknown,unknown,unknown,,,,,"semi-finished, finished rolled","billet, rebar",building and infrastructure,1037,unknown,unknown,No,EAF,unknown,unknown,unknown,Kamsky Metallurgical Works TEMPO,Камский металлургический комбинат ТЭМПО,Russia,operating,2016,504,,504,,,,,,
P100000120823,Lebedinsky GOK DRI Plant,Лебединский ГОК,LGOK HBI,"Лебединский горно-обогатительный комбинат, ЛГОК",Lebedinskiy GOK JSC,АО «Лебединский ГОК»,E100000130933,5000075458,,YueSeM Holding Company LLC,E100000131085,5079214447,"Promzona, Gubkin-11, Gubkin, Belgorod Oblast, Russia, 309191",Gubkin,Belgorod,Russia,Eurasia,"309191, Российская Федерация, Белгородская область, г. Губкин, промышленная зона Промплощадка Лгока","51.2619950, 37.6546220",exact,https://www.gem.wiki/Lebedinsky_GOK_DRI_Plant,54,unknown,1967,1971,unknown,unknown,unknown,unknown,unknown,unknown,8968,crude,"HBI, pellets",unknown,9459,unknown,unknown,No,DRI,own power source,Lebedinskiy and Stoylo-Lebedinskiy mines of the Kursk Magnetic Anomaly,unknown,Lebedinsky GOK DRI Plant,Лебединский ГОК,Russia,operating,1971,,,,,,4600,,4600,
P100000120807,Magnitogorsk Iron and Steel Works,Магнитогорский металлургический комбинат,"Magnitogorskiy Metallurgicheskiy Kombinat, MMK",ММК,Magnitogorskiy Metallurgicheskiy Kombinat PJSC,Магнитогорский Металлургический Комбинат ПАО,E100000002080,4295887044,,Magnitogorskiy Metallurgicheskiy Kombinat PJSC [100.0%],E100000002080 [100.0%],4295887044 [100.0%],"93 Kirov St, Magnitogorsk, Chelyabinsk Region, Russia, 455000",Magnitogorsk,Chelyabinsk,Russia,Eurasia,"455000, Российская Федерация, Челябинская область, г. Магнитогорск, ул. Кирова, д. 93","53.4275930, 59.0541220",exact,https://www.gem.wiki/Magnitogorsk_Iron_and_Steel_Works,93,unknown,unknown,1932,unknown,unknown,unknown,unknown,11300,5400,unknown,"semi-finished, finished rolled","coils and sheets with polymer coating, wire rod, rebar, plate, strip, bar, pipe, billet, coil, round bar, slab, angle","automotive, building and infrastructure, energy, steel packaging, tools and machinery, transport",16343,2022,2022,No,BF; BOF; EAF,Magnitogorsk PVS-2 MMK power station,Maly Kubais iron ore field,Tikhov and Kostromovskaya mines of the Nikitinskoye coalfield in Kuzbass,Magnitogorsk Iron and Steel Works,Магнитогорский металлургический комбинат,Russia,operating,1932,14500,10500.0,4000,,,7540,7540,,
